{
  "runtime_id": "generic-agent",
  "display_name": "Generic LLM Agent",
  "owner": "wfprieto",
  "support_level": "Manual",
  "activation_tier": "T4",
  "integration_shape": "always_on_instruction_file",
  "native_install_mechanism": "Operator supplies BOOTSTRAP.md manually",
  "install_scope": "project",
  "bootstrap_path": "BOOTSTRAP.md",
  "bootstrap_mode": "manual",
  "activation_marker": "WCBS_KIT_ACTIVE:generic-agent",
  "tool_mapping_path": "runtime_adapters/tool_mappings/generic-agent.json",
  "capabilities": {
    "file_read": "native",
    "file_write": "native",
    "file_edit": "native",
    "execute_command": "native",
    "subagents": "unavailable",
    "task_tracking": "unavailable",
    "web_access": "degradable",
    "browser_verification": "unavailable",
    "durable_artifact_storage": "degradable",
    "human_approval_gates": "degradable"
  },
  "fallbacks": {
    "subagents": "Sequential fresh-context review using the exact base..head package; report degraded independence.",
    "task_tracking": "Track task state in .wcbs/runs/<run-id>/progress-ledger.jsonl.",
    "web_access": "Require supplied source material and record Unknown rather than guessing.",
    "browser_verification": "Use command-line evidence and record rendered-UI verification as Not Run.",
    "durable_artifact_storage": "Write project-local .wcbs artifacts.",
    "human_approval_gates": "Halt and require an explicit human reply."
  },
  "supported_runtime_versions": "Any LLM agent with file read, write, edit, and command execution",
  "supported_operating_systems": [
    "macos",
    "linux",
    "windows"
  ],
  "modifies_user_files": false,
  "install": "Provide BOOTSTRAP.md at the start of every session.",
  "update": "Provide the updated Kernel file.",
  "uninstall": "Stop providing the file. Nothing is installed.",
  "rollback": "Provide the prior tagged Kernel file.",
  "limitations": "No native activation mechanism exists, so this is Manual by definition. If command execution is unavailable, the runtime is Unsupported.",
  "deprecation": "None. Baseline fallback adapter."
}
