{
  "runtime_id": "cursor",
  "display_name": "Cursor",
  "owner": "wfprieto",
  "support_level": "Full",
  "activation_tier": "T1",
  "integration_shape": "hybrid",
  "native_install_mechanism": "Cursor project rule plus SessionStart hook at .cursor/hooks.json",
  "install_scope": "project",
  "bootstrap_path": ".cursor/rules/super-build-kit.mdc",
  "bootstrap_mode": "automatic",
  "activation_marker": "WCBS_KIT_ACTIVE:cursor",
  "tool_mapping_path": "runtime_adapters/tool_mappings/cursor.json",
  "capabilities": {
    "file_read": "native",
    "file_write": "native",
    "file_edit": "native",
    "execute_command": "native",
    "subagents": "native",
    "task_tracking": "native",
    "web_access": "native",
    "browser_verification": "native",
    "durable_artifact_storage": "native",
    "human_approval_gates": "native"
  },
  "fallbacks": {},
  "supported_runtime_versions": "Cursor with Project Rules and hook support",
  "supported_operating_systems": [
    "macos",
    "linux",
    "windows"
  ],
  "modifies_user_files": false,
  "install": "Commit .cursor/rules/super-build-kit.mdc, .cursor/hooks.json, and hooks/. The project SessionStart hook invokes the WCBS transport.",
  "update": "Update the project rule, .cursor/hooks.json, Kernel, and hook files; Cursor re-reads them next session.",
  "uninstall": "Remove the Cursor rule, .cursor/hooks.json, and WCBS-owned hook files. Nothing outside the project is modified.",
  "rollback": "Restore the previous rule and hook files from version control.",
  "limitations": "The project hook path is structurally tested, but a clean Cursor runtime session is Not Run. If the hook is unavailable, activation degrades to the always-on rule and is recorded as T2.",
  "deprecation": "None. Adapter is active and supported."
}
