{
  "runtime_id": "codex",
  "display_name": "OpenAI Codex",
  "owner": "wfprieto",
  "support_level": "Full",
  "activation_tier": "T1",
  "integration_shape": "hybrid",
  "native_install_mechanism": "Codex plugin SessionStart hook and skills directory; bundled hooks require user trust",
  "install_scope": "project",
  "bootstrap_path": ".codex-plugin/plugin.json",
  "bootstrap_mode": "automatic",
  "activation_marker": "WCBS_KIT_ACTIVE:codex",
  "tool_mapping_path": "runtime_adapters/tool_mappings/codex.json",
  "capabilities": {
    "file_read": "native",
    "file_write": "native",
    "file_edit": "native",
    "execute_command": "native",
    "subagents": "native",
    "task_tracking": "native",
    "web_access": "native",
    "browser_verification": "native",
    "durable_artifact_storage": "native",
    "human_approval_gates": "native"
  },
  "fallbacks": {},
  "supported_runtime_versions": "Codex CLI and Codex app with plugin support",
  "supported_operating_systems": [
    "macos",
    "linux",
    "windows"
  ],
  "modifies_user_files": false,
  "install": "Install the plugin from .codex-plugin/plugin.json, then review and trust its SessionStart hook. The skills/ directory is registered automatically.",
  "update": "Update and reload the plugin; review the hook again if its definition changes.",
  "uninstall": "Remove the plugin from the Codex plugin list. No files outside the project are touched.",
  "rollback": "Reinstall the previously tagged plugin manifest, hook, renderer, and skills/.",
  "limitations": "Codex skips bundled hooks until the user reviews and trusts their current definition. Runtime activation remains Not Run until fresh-session proof passes.",
  "deprecation": "Designed adapter; runtime activation evidence is pending."
}
