{
  "runtime_id": "gemini",
  "display_name": "Gemini CLI",
  "owner": "wfprieto",
  "support_level": "Partial",
  "activation_tier": "T2",
  "integration_shape": "always_on_instruction_file",
  "native_install_mechanism": "GEMINI.md context file loaded at session start",
  "install_scope": "project",
  "bootstrap_path": "GEMINI.md",
  "bootstrap_mode": "automatic",
  "activation_marker": "WCBS_KIT_ACTIVE:gemini",
  "tool_mapping_path": "runtime_adapters/tool_mappings/gemini.json",
  "capabilities": {
    "file_read": "native",
    "file_write": "native",
    "file_edit": "native",
    "execute_command": "native",
    "subagents": "unavailable",
    "task_tracking": "degradable",
    "web_access": "native",
    "browser_verification": "unavailable",
    "durable_artifact_storage": "native",
    "human_approval_gates": "native"
  },
  "fallbacks": {
    "subagents": "Sequential fresh-context review using the exact base..head package; report degraded independence.",
    "task_tracking": "Track task state in .wcbs/runs/<run-id>/progress-ledger.jsonl.",
    "browser_verification": "Use command-line verification and record rendered-UI evidence as Not Run."
  },
  "supported_runtime_versions": "Gemini CLI with GEMINI.md hierarchical context support",
  "supported_operating_systems": [
    "macos",
    "linux",
    "windows"
  ],
  "modifies_user_files": false,
  "install": "Commit GEMINI.md at the repository root. Gemini CLI loads it as hierarchical context.",
  "update": "Edit GEMINI.md in the repository.",
  "uninstall": "Delete GEMINI.md.",
  "rollback": "Restore the previous revision from version control.",
  "limitations": "No independent subagents and no native browser verification; activation is instructed rather than enforced.",
  "deprecation": "None. Adapter is active and supported."
}
