{
  "runtime_id": "claude",
  "display_name": "Claude and Claude Code",
  "owner": "wfprieto",
  "support_level": "Full",
  "activation_tier": "T1",
  "integration_shape": "hybrid",
  "native_install_mechanism": "Claude Code plugin SessionStart hook plus CLAUDE.md fallback",
  "install_scope": "project",
  "bootstrap_path": ".claude-plugin/plugin.json",
  "bootstrap_mode": "automatic",
  "activation_marker": "WCBS_KIT_ACTIVE:claude",
  "tool_mapping_path": "runtime_adapters/tool_mappings/claude.json",
  "capabilities": {
    "file_read": "native",
    "file_write": "native",
    "file_edit": "native",
    "execute_command": "native",
    "subagents": "native",
    "task_tracking": "native",
    "web_access": "native",
    "browser_verification": "native",
    "durable_artifact_storage": "native",
    "human_approval_gates": "native"
  },
  "fallbacks": {},
  "supported_runtime_versions": "Claude Code plugin runtime and Claude surfaces that read CLAUDE.md project memory",
  "supported_operating_systems": [
    "macos",
    "linux",
    "windows"
  ],
  "modifies_user_files": false,
  "install": "Install .claude-plugin/plugin.json; the SessionStart hook loads the canonical using-wcbs router. CLAUDE.md remains the T2 fallback.",
  "update": "Update the plugin, Kernel, and hook files in the repository.",
  "uninstall": "Remove the Claude plugin registration and CLAUDE.md fallback. No shell profile is modified.",
  "rollback": "Restore the previously tagged plugin, hook, Kernel, and CLAUDE.md files.",
  "limitations": "Surfaces without plugin hooks degrade to CLAUDE.md T2 or manual activation and must record that lower tier.",
  "deprecation": "Designed adapter; runtime activation evidence is pending."
}
